[
  {
    "commit_sequence": "2",
    "commit_position": 0,
    "admitted_at": "2026-08-11T21:42:21.000Z",
    "object_kind": "record",
    "object_id": "urn:ccf:record:3e98b052-de3c-4c51-b6a0-e5eee3935196",
    "object_hash": "sha256:c8499f4f31b77e8f3ba413a0d1b873ad9dbf61dfeba0d1dec49e130761a93e02"
  },
  {
    "commit_sequence": "2",
    "commit_position": 1,
    "admitted_at": "2026-08-11T21:42:21.000Z",
    "object_kind": "record",
    "object_id": "urn:ccf:record:7a2cc59c-52e4-41cb-8e95-820bc655ee8d",
    "object_hash": "sha256:eac9e95f6878a0a4e549a4d0aec13485ed09ce69c54ddb691581742596dc7b7c"
  },
  {
    "commit_sequence": "2",
    "commit_position": 2,
    "admitted_at": "2026-08-11T21:42:21.000Z",
    "object_kind": "record",
    "object_id": "urn:ccf:record:e10694f9-8903-413a-9b53-9fb5765169ad",
    "object_hash": "sha256:240cf09bd5f66baf67358b3875699b8b6fe54bf5368cac89464882a3512bba28"
  },
  {
    "commit_sequence": "2",
    "commit_position": 3,
    "admitted_at": "2026-08-11T21:42:21.000Z",
    "object_kind": "record",
    "object_id": "urn:ccf:record:1e319572-9fca-4ab5-9f9a-1e73eddb3a8f",
    "object_hash": "sha256:76814769fd69a39e6d598754775dddf5bda0385daf7a29362f56047f1bbf6f7d"
  },
  {
    "commit_sequence": "2",
    "commit_position": 4,
    "admitted_at": "2026-08-11T21:42:21.000Z",
    "object_kind": "record",
    "object_id": "urn:ccf:record:2e9ea5e1-77c8-4d7e-9bf4-c411f8ace535",
    "object_hash": "sha256:20a065449324b09ca6c0f500b0d405a9ebd63e17b8e69a3eba2ab8a5d4bc19f6"
  },
  {
    "commit_sequence": "2",
    "commit_position": 5,
    "admitted_at": "2026-08-11T21:42:21.000Z",
    "object_kind": "record",
    "object_id": "urn:ccf:record:22ca77c3-ad70-4d53-84eb-97c80a2780e5",
    "object_hash": "sha256:6ca896f147e69757891dd68588f03158ff2dbdb6a19141865ce49f037ea8d7ec"
  },
  {
    "commit_sequence": "2",
    "commit_position": 6,
    "admitted_at": "2026-08-11T21:42:21.000Z",
    "object_kind": "record",
    "object_id": "urn:ccf:record:1428cd68-e7eb-4022-bb2b-a2d9695c626e",
    "object_hash": "sha256:69b7f83b1ad392e4ef7a367aa0278745cfd278a993fdc4cb41e9968697ec9a42"
  },
  {
    "commit_sequence": "2",
    "commit_position": 7,
    "admitted_at": "2026-08-11T21:42:21.000Z",
    "object_kind": "record",
    "object_id": "urn:ccf:record:9a1f6b0d-9725-4e48-bbf4-7c614e10f454",
    "object_hash": "sha256:e75d420cfe4b01a59e658ed38a66c5099d831cc350a670b4151288bb61005df2"
  },
  {
    "commit_sequence": "2",
    "commit_position": 8,
    "admitted_at": "2026-08-11T21:42:21.000Z",
    "object_kind": "link",
    "object_id": "urn:ccf:link:cf2e5dfe-a30d-457a-b924-b22f4df4e40b",
    "object_hash": "sha256:d833066f9b021434f08eb1b00e7c20b8d4d3f647ef26ab02599a41ffeee14fc5"
  },
  {
    "commit_sequence": "2",
    "commit_position": 9,
    "admitted_at": "2026-08-11T21:42:21.000Z",
    "object_kind": "link",
    "object_id": "urn:ccf:link:375828bd-15b4-4610-956b-86088c737a11",
    "object_hash": "sha256:24510d4a32ddc5d3ee0bcaf844c61a79adcdf977a92343b0c0191c868e03ad9d"
  },
  {
    "commit_sequence": "2",
    "commit_position": 10,
    "admitted_at": "2026-08-11T21:42:21.000Z",
    "object_kind": "link",
    "object_id": "urn:ccf:link:16f4474b-ecea-44de-9cd0-59b4a1523e10",
    "object_hash": "sha256:8d45babb1dff854b8ed6c75fbc1dfd4a5f611121b957cb3ffe1e5ac72e88e1ad"
  },
  {
    "commit_sequence": "2",
    "commit_position": 11,
    "admitted_at": "2026-08-11T21:42:21.000Z",
    "object_kind": "link",
    "object_id": "urn:ccf:link:ba3fe509-e43d-4879-a298-d3a7d66e01cf",
    "object_hash": "sha256:77d114b1ee49a8140568d7e2da0920bb90056e9c72e9ab564d847b1404dd595b"
  },
  {
    "commit_sequence": "2",
    "commit_position": 12,
    "admitted_at": "2026-08-11T21:42:21.000Z",
    "object_kind": "link",
    "object_id": "urn:ccf:link:e41b724b-c3e8-4550-880f-ac16f0b07399",
    "object_hash": "sha256:1902fc2af27f984641c9c4525cf3e783c3eb77090a184c6a4a90988abcdf68a9"
  },
  {
    "commit_sequence": "2",
    "commit_position": 13,
    "admitted_at": "2026-08-11T21:42:21.000Z",
    "object_kind": "link",
    "object_id": "urn:ccf:link:82de4b0d-a83d-4db8-8bf0-522f87b8b818",
    "object_hash": "sha256:5899b365af0f883808bf8568e7cab07d3ba488cbc592fec7e42c177d6950435f"
  },
  {
    "commit_sequence": "2",
    "commit_position": 14,
    "admitted_at": "2026-08-11T21:42:21.000Z",
    "object_kind": "link",
    "object_id": "urn:ccf:link:2ce385ef-a58d-405b-9dcd-04703d0f60f4",
    "object_hash": "sha256:2b76bb2d7009df60d3898c27604a617bf3e71197898c227aee85f85285641e9c"
  },
  {
    "commit_sequence": "2",
    "commit_position": 15,
    "admitted_at": "2026-08-11T21:42:21.000Z",
    "object_kind": "blob",
    "object_id": "urn:ccf:blob:caaba9bd-5b2a-47fd-90f7-85a449eea291",
    "object_hash": "sha256:8ba9c9f49efd09e35f421732901816898f5d9ac07e3d155aa2efef5abc68bd22"
  }
]
