[
  {
    "commit_sequence": "2",
    "commit_position": 0,
    "admitted_at": "2026-08-11T21:42:21.000Z",
    "object_kind": "record",
    "object_id": "urn:ccf:record:4e9f8cc9-563a-4d61-8221-9f55e9db39bd",
    "object_hash": "sha256:058b11e05d47c0ead576693f79ae9b5884700c3fb2cd3a253acf813d58e3ac43"
  },
  {
    "commit_sequence": "2",
    "commit_position": 1,
    "admitted_at": "2026-08-11T21:42:21.000Z",
    "object_kind": "record",
    "object_id": "urn:ccf:record:b7972dfb-99c3-4376-897f-3c9f2848138b",
    "object_hash": "sha256:cf8a4ca385af4481e4d85fd445b2ed31154c7ba427051761abde1dbb962c6dfd"
  },
  {
    "commit_sequence": "2",
    "commit_position": 2,
    "admitted_at": "2026-08-11T21:42:21.000Z",
    "object_kind": "record",
    "object_id": "urn:ccf:record:4d8feff5-3956-4190-9679-203f34a09de1",
    "object_hash": "sha256:57b2c937503a76f495dd1fcef4541149739e054f9d148cd59a9dd015ddb51e1c"
  },
  {
    "commit_sequence": "2",
    "commit_position": 3,
    "admitted_at": "2026-08-11T21:42:21.000Z",
    "object_kind": "record",
    "object_id": "urn:ccf:record:4bc9c0eb-a3b3-4d1f-8b61-d58225d3a203",
    "object_hash": "sha256:3184970b804382da516734038ebb7123892f2b5a72dbd4546ebc3ec8af983f0f"
  },
  {
    "commit_sequence": "2",
    "commit_position": 4,
    "admitted_at": "2026-08-11T21:42:21.000Z",
    "object_kind": "record",
    "object_id": "urn:ccf:record:63607ea0-9d26-4625-ab23-65ce7415b571",
    "object_hash": "sha256:32b9c32f66753625bb93c958c2e985f207b884eb01ffdf52b702dddccec5f61e"
  },
  {
    "commit_sequence": "2",
    "commit_position": 5,
    "admitted_at": "2026-08-11T21:42:21.000Z",
    "object_kind": "record",
    "object_id": "urn:ccf:record:396faaaf-52c3-494d-b456-bbb1b8889cbf",
    "object_hash": "sha256:86063f0c3be7354e25180ab69146c799ba0014e2f6c185a5f8c9867dd919eec8"
  },
  {
    "commit_sequence": "2",
    "commit_position": 6,
    "admitted_at": "2026-08-11T21:42:21.000Z",
    "object_kind": "record",
    "object_id": "urn:ccf:record:a01f8c5c-8278-4a2b-bccb-c270ca803586",
    "object_hash": "sha256:947c6119cba968cbde452417a084c971ef4fcfc38b8a53758d834fc40919bb91"
  },
  {
    "commit_sequence": "2",
    "commit_position": 7,
    "admitted_at": "2026-08-11T21:42:21.000Z",
    "object_kind": "record",
    "object_id": "urn:ccf:record:2e96f116-6c1a-4216-8ac5-63d0b5da108f",
    "object_hash": "sha256:7bb840239d50a09a5ad157a2b5b6e11f4e15a829608574a03a90212b692d8ccc"
  },
  {
    "commit_sequence": "2",
    "commit_position": 8,
    "admitted_at": "2026-08-11T21:42:21.000Z",
    "object_kind": "record",
    "object_id": "urn:ccf:record:ce293b52-58f1-4f52-87d1-4b7d5e75edb8",
    "object_hash": "sha256:6b06c698dadc1f8a8041708fdfd7768d518c2dea5302b851fa877d4ecd2beb3e"
  },
  {
    "commit_sequence": "2",
    "commit_position": 9,
    "admitted_at": "2026-08-11T21:42:21.000Z",
    "object_kind": "record",
    "object_id": "urn:ccf:record:4034e10b-7a56-46b6-9162-d1cf909f8a78",
    "object_hash": "sha256:a27603dec50495e497f1c2aeb41ba06a930091abf25bdaf9a98ca1f377c33cc6"
  },
  {
    "commit_sequence": "2",
    "commit_position": 10,
    "admitted_at": "2026-08-11T21:42:21.000Z",
    "object_kind": "record",
    "object_id": "urn:ccf:record:649042b4-1519-4dfb-8de9-9dffb167de34",
    "object_hash": "sha256:588c3252f8265098eeadef78427b3d6259b3f9b3f3d6ebb07831931f186d2b6e"
  },
  {
    "commit_sequence": "2",
    "commit_position": 11,
    "admitted_at": "2026-08-11T21:42:21.000Z",
    "object_kind": "link",
    "object_id": "urn:ccf:link:a3a6c051-271d-47cf-bee5-35fc66d903c2",
    "object_hash": "sha256:b557d79fb6456c645ee63e272e6c40759453c14e09689305a94b6c07bf5fc826"
  },
  {
    "commit_sequence": "2",
    "commit_position": 12,
    "admitted_at": "2026-08-11T21:42:21.000Z",
    "object_kind": "link",
    "object_id": "urn:ccf:link:1ae193bd-79bd-4535-bbd3-a670dba025ff",
    "object_hash": "sha256:e8f2483f6afa75903ec6eba4fb20d2f2082522674d797584dd3d78f145b45004"
  },
  {
    "commit_sequence": "2",
    "commit_position": 13,
    "admitted_at": "2026-08-11T21:42:21.000Z",
    "object_kind": "link",
    "object_id": "urn:ccf:link:098c30cb-13fa-42b1-96f4-923ce82dd9d3",
    "object_hash": "sha256:108987c29bd07c5713b35b151a22063c97e7e0a484c3cdfd6178ac4d4d63ba05"
  },
  {
    "commit_sequence": "2",
    "commit_position": 14,
    "admitted_at": "2026-08-11T21:42:21.000Z",
    "object_kind": "link",
    "object_id": "urn:ccf:link:d8302220-fcda-466a-ae4f-58b116746b4e",
    "object_hash": "sha256:d41c0ce4c27dbd1f1a5fece4a7ea11ad501b981f199e878ade760ae592d41384"
  },
  {
    "commit_sequence": "2",
    "commit_position": 15,
    "admitted_at": "2026-08-11T21:42:21.000Z",
    "object_kind": "link",
    "object_id": "urn:ccf:link:a3eedfcb-016b-4f1b-a58a-3afe9b9d1e62",
    "object_hash": "sha256:3e13d7263907e69d010adb51ee5628e66638461ceaf18b3bc57422bdb36f85a1"
  },
  {
    "commit_sequence": "2",
    "commit_position": 16,
    "admitted_at": "2026-08-11T21:42:21.000Z",
    "object_kind": "link",
    "object_id": "urn:ccf:link:76a63205-f0d1-4502-b29e-c44e0d1c6645",
    "object_hash": "sha256:845b1c1e3ad8d6de5d11eb46bb0ac2cc6f9e3a19fda7a6caaab04ed5140bd512"
  },
  {
    "commit_sequence": "2",
    "commit_position": 17,
    "admitted_at": "2026-08-11T21:42:21.000Z",
    "object_kind": "link",
    "object_id": "urn:ccf:link:e807d6c8-6589-4ac2-bed4-032207901261",
    "object_hash": "sha256:0d556f707d177820a141ab619123e133e8007c584b797a8f646e2a044eaa24e7"
  },
  {
    "commit_sequence": "2",
    "commit_position": 18,
    "admitted_at": "2026-08-11T21:42:21.000Z",
    "object_kind": "link",
    "object_id": "urn:ccf:link:c78ac8a7-56fa-4c79-b74b-640d3cc82a09",
    "object_hash": "sha256:31c2d69109470440b4cf38516f6b3aee3505163ea03013472596aa8ff5145cca"
  },
  {
    "commit_sequence": "2",
    "commit_position": 19,
    "admitted_at": "2026-08-11T21:42:21.000Z",
    "object_kind": "blob",
    "object_id": "urn:ccf:blob:4393e9d0-c150-448d-9b27-05872973abab",
    "object_hash": "sha256:eaca7887bf6f73ab096609661ec726bfb3c67812e7ddcba62448a0e8088a0c8d"
  },
  {
    "commit_sequence": "2",
    "commit_position": 20,
    "admitted_at": "2026-08-11T21:42:21.000Z",
    "object_kind": "blob",
    "object_id": "urn:ccf:blob:ce293b52-58f1-4f52-87d1-4b7d5e75edb8",
    "object_hash": "sha256:d84400c41db8123f26456c85e10f50e56bd374d46834d871e7aee74586d96536"
  }
]
