[
  {
    "commit_sequence": "2",
    "commit_position": 0,
    "admitted_at": "2026-08-11T21:42:21.000Z",
    "object_kind": "record",
    "object_id": "urn:ccf:record:4e9f8cc9-563a-4d61-8221-9f55e9db39bd",
    "object_hash": "sha256:6b666c6508b1e015caff5ef0e0899fee2b73344bb0611df013fbc4891890fa09"
  },
  {
    "commit_sequence": "2",
    "commit_position": 1,
    "admitted_at": "2026-08-11T21:42:21.000Z",
    "object_kind": "record",
    "object_id": "urn:ccf:record:b7972dfb-99c3-4376-897f-3c9f2848138b",
    "object_hash": "sha256:97b5eea3f6178a34a6c0633eb31b15eca8cf22419fdb0e584cff710dd43af303"
  },
  {
    "commit_sequence": "2",
    "commit_position": 2,
    "admitted_at": "2026-08-11T21:42:21.000Z",
    "object_kind": "record",
    "object_id": "urn:ccf:record:4d8feff5-3956-4190-9679-203f34a09de1",
    "object_hash": "sha256:ab6c98e35bb7aba8b9c7aa067c387700157562fef539b79533851c1533997d86"
  },
  {
    "commit_sequence": "2",
    "commit_position": 3,
    "admitted_at": "2026-08-11T21:42:21.000Z",
    "object_kind": "record",
    "object_id": "urn:ccf:record:4bc9c0eb-a3b3-4d1f-8b61-d58225d3a203",
    "object_hash": "sha256:3fc5342f78e8c6d481bbef32ed03caf996b3681c632b9489976baa51706dea60"
  },
  {
    "commit_sequence": "2",
    "commit_position": 4,
    "admitted_at": "2026-08-11T21:42:21.000Z",
    "object_kind": "record",
    "object_id": "urn:ccf:record:63607ea0-9d26-4625-ab23-65ce7415b571",
    "object_hash": "sha256:b6019ece8627cb30a56769cffdc126850a00532bcf504e80c4d88a5dfbddf9e9"
  },
  {
    "commit_sequence": "2",
    "commit_position": 5,
    "admitted_at": "2026-08-11T21:42:21.000Z",
    "object_kind": "record",
    "object_id": "urn:ccf:record:396faaaf-52c3-494d-b456-bbb1b8889cbf",
    "object_hash": "sha256:be0e7176a89e4ac53547a5e50076ee56f0a5b1a1bbf3a4cc108db9312034bdcb"
  },
  {
    "commit_sequence": "2",
    "commit_position": 6,
    "admitted_at": "2026-08-11T21:42:21.000Z",
    "object_kind": "record",
    "object_id": "urn:ccf:record:a01f8c5c-8278-4a2b-bccb-c270ca803586",
    "object_hash": "sha256:b0d847c5bc0cf589dd8587b5e471010ab7611227048d28016385cb5abe90731b"
  },
  {
    "commit_sequence": "2",
    "commit_position": 7,
    "admitted_at": "2026-08-11T21:42:21.000Z",
    "object_kind": "record",
    "object_id": "urn:ccf:record:2e96f116-6c1a-4216-8ac5-63d0b5da108f",
    "object_hash": "sha256:de9a7f96a8ab67b000d9c1214130f9a9f18cbf3322bb9a98dfeaf7d22770aced"
  },
  {
    "commit_sequence": "2",
    "commit_position": 8,
    "admitted_at": "2026-08-11T21:42:21.000Z",
    "object_kind": "record",
    "object_id": "urn:ccf:record:ce293b52-58f1-4f52-87d1-4b7d5e75edb8",
    "object_hash": "sha256:bd40aacd05e9fdd7f208d483c564c4c32c3a887ee402dfa1c89386fa8efcb69b"
  },
  {
    "commit_sequence": "2",
    "commit_position": 9,
    "admitted_at": "2026-08-11T21:42:21.000Z",
    "object_kind": "record",
    "object_id": "urn:ccf:record:4034e10b-7a56-46b6-9162-d1cf909f8a78",
    "object_hash": "sha256:3a3cec80d39ce2f26ef84b1ca971a46b23e3fba002a36083ace3b31cc2ec12b3"
  },
  {
    "commit_sequence": "2",
    "commit_position": 10,
    "admitted_at": "2026-08-11T21:42:21.000Z",
    "object_kind": "record",
    "object_id": "urn:ccf:record:649042b4-1519-4dfb-8de9-9dffb167de34",
    "object_hash": "sha256:588c3252f8265098eeadef78427b3d6259b3f9b3f3d6ebb07831931f186d2b6e"
  },
  {
    "commit_sequence": "2",
    "commit_position": 11,
    "admitted_at": "2026-08-11T21:42:21.000Z",
    "object_kind": "link",
    "object_id": "urn:ccf:link:a3a6c051-271d-47cf-bee5-35fc66d903c2",
    "object_hash": "sha256:cc7e967a55ac68a3e39539bf6dbae9e3ba7dec50c4768d7eb878382b525bbb7f"
  },
  {
    "commit_sequence": "2",
    "commit_position": 12,
    "admitted_at": "2026-08-11T21:42:21.000Z",
    "object_kind": "link",
    "object_id": "urn:ccf:link:1ae193bd-79bd-4535-bbd3-a670dba025ff",
    "object_hash": "sha256:0c79cc9677f08979c81d13513a4a13483eae97c2141b8b9064367069254fe2ad"
  },
  {
    "commit_sequence": "2",
    "commit_position": 13,
    "admitted_at": "2026-08-11T21:42:21.000Z",
    "object_kind": "link",
    "object_id": "urn:ccf:link:098c30cb-13fa-42b1-96f4-923ce82dd9d3",
    "object_hash": "sha256:c177591b051e621daff18c9b8f0238d23f6c3d6d7f0d93cce0c859bb4eb40ef7"
  },
  {
    "commit_sequence": "2",
    "commit_position": 14,
    "admitted_at": "2026-08-11T21:42:21.000Z",
    "object_kind": "link",
    "object_id": "urn:ccf:link:d8302220-fcda-466a-ae4f-58b116746b4e",
    "object_hash": "sha256:85f9ed72cae4dc91f8c50dfd39ee3d2fcab0ed85307c7883b01d0c1c32e343b5"
  },
  {
    "commit_sequence": "2",
    "commit_position": 15,
    "admitted_at": "2026-08-11T21:42:21.000Z",
    "object_kind": "link",
    "object_id": "urn:ccf:link:a3eedfcb-016b-4f1b-a58a-3afe9b9d1e62",
    "object_hash": "sha256:5f939c7cd2bc77fa47e7fda7ef8868b12681a55976d2ed1e6175de5afe697e20"
  },
  {
    "commit_sequence": "2",
    "commit_position": 16,
    "admitted_at": "2026-08-11T21:42:21.000Z",
    "object_kind": "link",
    "object_id": "urn:ccf:link:76a63205-f0d1-4502-b29e-c44e0d1c6645",
    "object_hash": "sha256:67ec2580607a7cf9d2e128889ba90ccabcbaa58edabe0ec5a6202b05ad8b52fb"
  },
  {
    "commit_sequence": "2",
    "commit_position": 17,
    "admitted_at": "2026-08-11T21:42:21.000Z",
    "object_kind": "link",
    "object_id": "urn:ccf:link:e807d6c8-6589-4ac2-bed4-032207901261",
    "object_hash": "sha256:ebb9e65a55d66e8a428c71f18da6999ce9e75d0b2354179ce10839a4992e54ac"
  },
  {
    "commit_sequence": "2",
    "commit_position": 18,
    "admitted_at": "2026-08-11T21:42:21.000Z",
    "object_kind": "link",
    "object_id": "urn:ccf:link:c78ac8a7-56fa-4c79-b74b-640d3cc82a09",
    "object_hash": "sha256:110af19be7f59fe2113ac0f65983f1b003e8d3ecf993a39a6dcd03b28fbe4beb"
  },
  {
    "commit_sequence": "2",
    "commit_position": 19,
    "admitted_at": "2026-08-11T21:42:21.000Z",
    "object_kind": "blob",
    "object_id": "urn:ccf:blob:4393e9d0-c150-448d-9b27-05872973abab",
    "object_hash": "sha256:f527192180ee4a4764d4b4a9cf3037197f0a6936c21e3210eb1d59263110379a"
  },
  {
    "commit_sequence": "2",
    "commit_position": 20,
    "admitted_at": "2026-08-11T21:42:21.000Z",
    "object_kind": "blob",
    "object_id": "urn:ccf:blob:ce293b52-58f1-4f52-87d1-4b7d5e75edb8",
    "object_hash": "sha256:fb663fead2cd851b2088f13d489147fabc193694d0735727731aca88af0eba71"
  }
]
