[
  {
    "commit_sequence": "1",
    "commit_position": 0,
    "admitted_at": "2026-08-11T21:40:01.000Z",
    "object_kind": "record",
    "object_id": "urn:ccf:record:b1d37833-91d1-4bfd-8f90-b949a0a85df6",
    "object_hash": "sha256:ea7ff72d1b9ad13aee43307b373a0ad3c893e4d9f54f3f6a8562d8c9f66e29ad"
  },
  {
    "commit_sequence": "1",
    "commit_position": 1,
    "admitted_at": "2026-08-11T21:40:01.000Z",
    "object_kind": "record",
    "object_id": "urn:ccf:record:8f1d4498-c2e8-4457-a998-5c8c5a43c57b",
    "object_hash": "sha256:d9a9ce45b1bc82a508cfcd82ffe99c398d3ea195695dcc4d0d28054b226aeb78"
  },
  {
    "commit_sequence": "1",
    "commit_position": 2,
    "admitted_at": "2026-08-11T21:40:01.000Z",
    "object_kind": "record",
    "object_id": "urn:ccf:record:8006f1b0-5c0a-4209-890a-e86f44ef189a",
    "object_hash": "sha256:cb563941a245f1b0a91c1dbaecd7768db0ea9d5c6f30dbf8ea6560db970cd9e3"
  },
  {
    "commit_sequence": "1",
    "commit_position": 3,
    "admitted_at": "2026-08-11T21:40:01.000Z",
    "object_kind": "record",
    "object_id": "urn:ccf:record:5744816a-35ff-47ff-a452-e177a4b839c9",
    "object_hash": "sha256:7d4b063402f031922b2c268ca47b2c3dc3dd96ee03bddea25b02eb0745de6693"
  }
]
