[
  {
    "commit_sequence": "1",
    "commit_position": 0,
    "admitted_at": "2026-08-11T21:40:01.000Z",
    "object_kind": "record",
    "object_id": "urn:ccf:record:15b2492f-59a8-4e6a-93a2-c3b4a134c345",
    "object_hash": "sha256:58efe94b07ee215fee6bd8a26d5a8c19801658e3b3011a0d643d248a7087e564"
  },
  {
    "commit_sequence": "1",
    "commit_position": 1,
    "admitted_at": "2026-08-11T21:40:01.000Z",
    "object_kind": "record",
    "object_id": "urn:ccf:record:ef73705f-4910-4bfa-ab60-cf08d8169b6d",
    "object_hash": "sha256:753e35433076afd41afab1f992d97b00f284093be0421cca3420cbf9802ad107"
  },
  {
    "commit_sequence": "1",
    "commit_position": 2,
    "admitted_at": "2026-08-11T21:40:01.000Z",
    "object_kind": "record",
    "object_id": "urn:ccf:record:a5e2e478-195c-4f2e-8329-a13a1e1fef7e",
    "object_hash": "sha256:76a1dadc2a87641bb10b9f11c775bf7a4f6deb8960866ab15db73dc0d70ead39"
  },
  {
    "commit_sequence": "1",
    "commit_position": 3,
    "admitted_at": "2026-08-11T21:40:01.000Z",
    "object_kind": "record",
    "object_id": "urn:ccf:record:fa001749-4cb0-4117-a8b7-9dbc02a811cd",
    "object_hash": "sha256:2ef0598fffc14d3edfb0429f0f2efbccae3d8d79b21b33dbb6fbf25561867c62"
  }
]
