[
  {
    "commit_sequence": "1",
    "commit_position": 0,
    "admitted_at": "2026-08-11T21:40:01.000Z",
    "object_kind": "record",
    "object_id": "urn:ccf:record:03e09d92-b68b-467d-b3c9-18a15be891be",
    "object_hash": "sha256:6291e538838914ffe6991504bc00ca896c4eb53af3cc6e6ee4e3effdaeb3f03b"
  },
  {
    "commit_sequence": "1",
    "commit_position": 1,
    "admitted_at": "2026-08-11T21:40:01.000Z",
    "object_kind": "record",
    "object_id": "urn:ccf:record:908e42a4-f136-458f-8cf9-7597922fab21",
    "object_hash": "sha256:ff44511c5cb03f3ff1129d5448446dd1bd46ee05d488a3c2acc43839082d16c9"
  },
  {
    "commit_sequence": "1",
    "commit_position": 2,
    "admitted_at": "2026-08-11T21:40:01.000Z",
    "object_kind": "record",
    "object_id": "urn:ccf:record:682d6151-5dd6-42d8-874c-895c3a501f09",
    "object_hash": "sha256:53fefce825e44eb31c411be72932eb3278a4765ae48aaeef3f991bfc6aca654f"
  },
  {
    "commit_sequence": "1",
    "commit_position": 3,
    "admitted_at": "2026-08-11T21:40:01.000Z",
    "object_kind": "record",
    "object_id": "urn:ccf:record:405c475b-1c4c-4e05-b978-28246bb3a5fa",
    "object_hash": "sha256:7f08f57e56c0a776ea1b10abe2260d7500b0c382c831a08f633cf0166b4e6f1d"
  }
]
