[
  {
    "commit_sequence": "1",
    "commit_position": 0,
    "admitted_at": "2026-08-11T21:40:01.000Z",
    "object_kind": "record",
    "object_id": "urn:ccf:record:03e09d92-b68b-467d-b3c9-18a15be891be",
    "object_hash": "sha256:e57851ddec5a839632de3ebd13c350ae8db724496473078180d94f5f52fcf225"
  },
  {
    "commit_sequence": "1",
    "commit_position": 1,
    "admitted_at": "2026-08-11T21:40:01.000Z",
    "object_kind": "record",
    "object_id": "urn:ccf:record:908e42a4-f136-458f-8cf9-7597922fab21",
    "object_hash": "sha256:74b9093df187b9d10c742f3bae34bbde6046c5cef42f4d7e25213a26c9b717aa"
  },
  {
    "commit_sequence": "1",
    "commit_position": 2,
    "admitted_at": "2026-08-11T21:40:01.000Z",
    "object_kind": "record",
    "object_id": "urn:ccf:record:682d6151-5dd6-42d8-874c-895c3a501f09",
    "object_hash": "sha256:9e00cefbab5cefcea109e27788d83f4e14881e3b161475aba1653bd2dd377827"
  },
  {
    "commit_sequence": "1",
    "commit_position": 3,
    "admitted_at": "2026-08-11T21:40:01.000Z",
    "object_kind": "record",
    "object_id": "urn:ccf:record:405c475b-1c4c-4e05-b978-28246bb3a5fa",
    "object_hash": "sha256:7f08f57e56c0a776ea1b10abe2260d7500b0c382c831a08f633cf0166b4e6f1d"
  }
]
